系列,编号,派系,卡牌名称,备用卡牌名称,图片链接,类型,独有,卡牌费用,初始威胁,意志力,攻击力,防御力,生命值,任务点,属性,警戒,远攻,限制,隐匿,厄运,遭遇,守护,协同,种族,规则文字,功能,人数,精神,战术,领导,学识,中立,1352
基础,1,领导,阿拉贡,亚拉冈,51223bd0-ffd1-11df-a976-0801200c9001,英雄,*,,12,2,3,2,5,,登丹人.贵族.游侠.,√,,,,,,,,登丹人,"警戒.
响应：在指派亚拉冈执行任务后，从他的资源池中支付1枚资源标记，以重置亚拉冈",攻击,多人,,,,,,
基础,2,领导,希奥杰德,希优顿,51223bd0-ffd1-11df-a976-0801200c9002,英雄,*,,8,1,2,1,4,,贵族.洛汗.战士.,,,,,,,,,洛汗,响应：在指派希优德执行任务后，选择一名被指派执行该任务的英雄。增加1枚资源标记到该英雄的资源池内。,,,,,,,,
基础,3,领导,格罗因,葛罗音,51223bd0-ffd1-11df-a976-0801200c9003,英雄,*,,9,2,2,1,4,,矮人.贵族.,,,,,,,,,矮人,响应：在葛罗音受到伤害后，他刚才每受到1点伤害，增加1枚资源标记到他的资源池中。,,,,,,,,
基础,4,战术,吉姆利,金雳,51223bd0-ffd1-11df-a976-0801200c9004,英雄,*,,11,2,2,2,5,,矮人.贵族.战士.,,,,,,,,,矮人,金雳每有1枚伤害标记，他获得+1【攻击力】。,攻击,,,,,,,
基础,5,战术,莱戈拉斯,勒苟拉斯,51223bd0-ffd1-11df-a976-0801200c9005,英雄,*,,9,1,3,1,4,,贵族.西尔凡精灵.战士.,,√,,,,,,,西尔凡精灵,"远攻.
响应：在勒苟拉斯参与一次攻击并消灭敌军后，放置2枚进度标记到当前任务上。",攻击,多人,,,,,,
基础,6,战术,沙林,萨林,51223bd0-ffd1-11df-a976-0801200c9006,英雄,*,,9,1,2,2,4,,矮人.战士.,,,,,,,,,矮人,当萨林被指派执行任务时，对每个刚从遭遇牌组展示的敌军造成1点伤害。,,,,,,,,
基础,7,精神,伊奥温,伊欧玟,51223bd0-ffd1-11df-a976-0801200c9007,英雄,*,,9,4,1,1,3,,贵族.洛汗.,,,,,,,,,洛汗,行动：从你的手牌中弃除一张卡牌，以使伊欧玟获得+1【意志力】直到本阶段结束。每回合每位玩家可以触发一次本效果。,任务,单人,,,,,,
基础,8,精神,埃莉诺,埃莉诺,51223bd0-ffd1-11df-a976-0801200c9008,英雄,*,,7,1,1,2,3,,刚铎.贵族.,,,,,,,,,刚铎,响应：横置埃莉诺，以取消一张刚从遭遇牌组展示的阴谋牌的“展示后”效果。然后，弃除该卡牌，并以遭遇牌组的下一张卡牌代替。,,,,,,,,
基础,9,精神,敦赫雷,督希尔,51223bd0-ffd1-11df-a976-0801200c9009,英雄,*,,8,1,2,1,4,,"洛汗.
战士.",,,,,,,,,洛汗,当督希尔单独攻击时，他能将场景区中的敌军作为目标。他这样做时，他获得+1【攻击力】。,攻击,,,,,,,
基础,10,学识,德内梭尔,迪奈瑟,51223bd0-ffd1-11df-a976-0801200c9010,英雄,*,,8,1,1,3,3,,刚铎.贵族.摄政王.,,,,,,,,,刚铎,行动：横置迪奈瑟，以查看遭遇牌组顶端的一张卡牌。你可以将该卡牌移至牌组底端。,防御,,,,,,,
基础,11,学识,格罗芬德尔,葛罗芬戴尔,51223bd0-ffd1-11df-a976-0801200c9011,英雄,*,,12,3,3,1,5,,贵族.诺多精灵.战士.,,,,,,,,,诺多精灵,行动：从葛罗芬戴尔的资源池中支付1枚资源标记，以治疗任一角色的1点伤害。（每个回合限制1次）,任务,,,,,,,
基础,12,学识,贝拉芙,贝拉沃,51223bd0-ffd1-11df-a976-0801200c9012,英雄,*,,10,2,2,2,4,,登丹人.游侠.,,,,,,,,,登丹人,行动：横置贝拉沃，以选择一位玩家。该玩家补两张卡牌。每个回合限制1次。,,,,,,,,
基础,13,领导,王城禁卫,都城守卫,51223bd0-ffd1-11df-a976-0801200c9013,盟友,,2,,1,1,0,2,,刚铎.战士.,,,,,,,,,刚铎,,,,,,,,,
基础,14,领导,法拉米尔,法拉墨,51223bd0-ffd1-11df-a976-0801200c9014,盟友,*,4,,2,1,2,3,,刚铎.贵族.游侠.,,,,,,,,,刚铎,行动：横置法拉墨，以选择一位玩家。该玩家控制的每名角色获得+1【意志力】直到本阶段结束。,任务,,,,,,,
基础,15,领导,阿尔诺之子,亚尔诺之子,51223bd0-ffd1-11df-a976-0801200c9015,盟友,,3,,0,2,0,2,,登丹人.,,,,,,,,,登丹人,响应：在亚尔诺之子进场后，选择一张在场景区中或当前与另一玩家交锋的敌军牌。与该敌军交锋。,攻击,,,,,,,
基础,16,领导,雪河斥候,雪界河斥候,51223bd0-ffd1-11df-a976-0801200c9016,盟友,,1,,0,0,1,1,,"洛汗.
斥候.",,,,,,,,,洛汗,响应：在雪界河斥候进场后，选择一个地区。放置1枚进度标记到该地区上。,,,,,,,,
基础,17,领导,银脉河弓手,银光河弓箭手,51223bd0-ffd1-11df-a976-0801200c9017,盟友,,3,,1,2,0,1,,弓箭手.西尔凡精灵.,,√,,,,,,,西尔凡精灵,远攻.,攻击,多人,,,,,,
基础,18,领导,长须奥克屠戮者,长须屠兽者,51223bd0-ffd1-11df-a976-0801200c9018,盟友,,4,,0,2,1,3,,矮人.战士.,,,,,,,,,矮人,响应：在长须屠兽者进场后，对在场的每个半兽人敌军造成1点伤害。,攻击,,,,,,,
基础,19,领导,布洛克·铁拳,铁拳布洛克,51223bd0-ffd1-11df-a976-0801200c9019,盟友,*,6,,2,2,1,4,,矮人.战士.,,,,,,,,,矮人,响应：在你控制的一名矮人英雄离场后，将铁拳布洛克从你的手牌中放置进场,攻击,,,,,,,
基础,20,领导,保持警惕,保持警惕,51223bd0-ffd1-11df-a976-0801200c9020,事件,,1,,,,,,,,,,,,,,,,,行动：选择并重置一张盟友牌。,,,,,,,,
基础,21,领导,同心协力,同心协力,51223bd0-ffd1-11df-a976-0801200c9021,事件,,0,,,,,,,,,,,,,,,,,行动：横置一名你控制的英雄，以选择并重置一名不同的英雄。,,多人,,,,,,
基础,22,领导,刚铎万岁！,刚铎万岁！,51223bd0-ffd1-11df-a976-0801200c9022,事件,,2,,,,,,,,,,,,,,,,,行动：所有角色获得+1【攻击力】直到本阶段结束。所有刚铎角色额外获得+1【防御力】直到本阶段结束。,,多人,,,,,,
基础,23,领导,偷袭,偷袭,51223bd0-ffd1-11df-a976-0801200c9023,事件,,1,,,,,,,,,,,,,,,,,行动：将一张盟友牌从你的手牌中放置进场。在本阶段结束时，如果该盟友依然在场，将其返回你的手牌。,,,,,,,,
基础,24,领导,英勇牺牲,英勇牺牲,51223bd0-ffd1-11df-a976-0801200c9024,事件,,1,,,,,,,,,,,,,,,,,响应：在一张盟友牌离场后，该卡牌的控制者补两张卡牌。,,,,,,,,
基础,25,领导,坚定的决心,坚定的决心,51223bd0-ffd1-11df-a976-0801200c9025,事件,,5,,,,,,,,,,,,,,,,,行动：重置在场的所有角色牌,,多人,,,,,,
基础,26,领导,刚铎宰相,刚铎摄政王,51223bd0-ffd1-11df-a976-0801200c9026,附属,*,2,,,,,,,刚铎.头衔.,,,,,,,,,刚铎,"附属到一名英雄上。 
所附属英雄获得刚铎属性。 
行动：横置刚铎摄政王，以增加2枚资源标记到所附属英雄的资源池中。",,,,,,,,
基础,27,领导,凯勒布莉安的宝石,凯勒布里安的宝石,51223bd0-ffd1-11df-a976-0801200c9027,附属,*,2,,,,,,,宝物.物品.,,,√,,,,,,,"限制.
附属到一名英雄上。 
所附属英雄获得+2【意志力】。 
如果所附属英雄是亚拉冈，他额外获得【精神】资源符号。",任务,,,,,,,
基础,28,战术,老练的斧手,老练的斧手,51223bd0-ffd1-11df-a976-0801200c9028,盟友,,2,,0,2,1,2,,矮人.战士.,,,,,,,,,矮人,,攻击,,,,,,,
基础,29,战术,刚铎长矛手,刚铎长枪兵,51223bd0-ffd1-11df-a976-0801200c9029,盟友,,2,,0,1,1,1,,刚铎.战士.,√,,,,,,,,刚铎,"警戒。 
响应：在刚铎长枪兵被宣告为防御者后，对攻击的敌军造成1点伤害。",防御,多人,,,,,,
基础,30,战术,弓骑兵,弓骑兵,51223bd0-ffd1-11df-a976-0801200c9030,盟友,,3,a,0,2,1,2,,洛汗.弓箭手.,,√,,,,,,,洛汗,远攻。,,多人,,,,,,
基础,31,战术,贝奥恩,比翁,51223bd0-ffd1-11df-a976-0801200c9031,盟友,*,6,,1,3,3,6,,比翁一族. 战士.,,,,,,,,,比翁一族,行动：比翁获得+5【攻击力】直到本阶段结束。在你触发本效果的阶段结束时，将比翁洗回你的牌组。（每个回合限制1次）,攻击,,,,,,,
基础,32,战术,精于剑术,精于剑术,51223bd0-ffd1-11df-a976-0801200c9032,事件,,1,,,,,,,,,,,,,,,,,行动：选择一名角色。该角色获得+1【攻击力】和+1【防御力】直到本阶段结束。,攻击,,,,,,,
基础,33,战术,箭雨,箭雨,51223bd0-ffd1-11df-a976-0801200c9033,事件,,1,,,,,,,,,,,,,,,,,行动：横置一名你控制的具有“远攻”关键词的角色，以选择一名玩家。对于该玩家交锋的每个敌军造成1点伤害。,攻击,,,,,,,
基础,34,战术,佯攻,佯攻,51223bd0-ffd1-11df-a976-0801200c9034,事件,,1,,,,,,,,,,,,,,,,,战斗行动：选择一个与玩家交锋的敌军。该敌军本阶段不能攻击该玩家。,防御,,,,,,,
基础,35,战术,先发制人,先发制人,51223bd0-ffd1-11df-a976-0801200c9035,事件,,1,,,,,,,,,,,,,,,,,行动：横置一名你控制的角色，以立即宣告其为攻击者（并结算此次攻击）攻击任一合理的敌军目标。,攻击,,,,,,,
基础,36,战术,密集的长矛,长枪方阵,51223bd0-ffd1-11df-a976-0801200c9036,事件,,3,,,,,,,,,,,,,,,,,"你必须使用来自三名不同英雄的资源池中的资源标记，以支付本卡牌。 
行动：选择一位玩家。与该玩家交锋的敌军本阶段不能攻击该玩家。",防御,多人,,,,,,
基础,37,战术,迅猛一击,迅猛一击,51223bd0-ffd1-11df-a976-0801200c9037,事件,,2,,,,,,,,,,,,,,,,,响应：在一名角色被宣告为防御者后，对攻击的敌军造成2点伤害。,防御,,,,,,,
基础,38,战术,并肩作战,并肩作战,51223bd0-ffd1-11df-a976-0801200c9038,事件,,0,,,,,,,,,,,,,,,,,行动：选择一位玩家。该玩家本阶段可以像每个攻击他的敌军宣告他任意数量的合理角色为防御者。,防御,,,,,,,
基础,39,战术,刚多林剑,贡多林之剑,51223bd0-ffd1-11df-a976-0801200c9039,附属,,1,,,,,,,"物品.
武器.",,,√,,,,,,,"限制.
附属到一名英雄上。 
当攻击半兽人时，所附属英雄获得+1【攻击力】。 
响应：在所附属英雄攻击并消灭敌军后，放置1枚进度标记到当前任务上。",攻击,,,,,,,
基础,40,战术,王城板甲,都城铠甲,51223bd0-ffd1-11df-a976-0801200c9040,附属,,4,,,,,,,物品.防具.,,,√,,,,,,,"限制. 
附属到一名英雄上。 
所附属英雄获得+4生命值。",防御,,,,,,,
基础,41,战术,矮人斧,矮人战斧,51223bd0-ffd1-11df-a976-0801200c9041,附属,,2,,,,,,,"物品.
武器.",,,√,,,,,,,"限制. 
附属到一名英雄上 。 
所附属英雄获得+1【攻击力】。（如果所附属英雄是矮人，则以+2【攻击力】代替。）",攻击,,,,,,,
基础,42,战术,刚铎号角,刚铎的号角,51223bd0-ffd1-11df-a976-0801200c9042,附属,*,1,,,,,,,物品.宝物.,,,√,,,,,,,"限制. 
附属到一名英雄上。 
响应：在一名角色被消灭后，增加1枚资源标记到所附属英雄的资源池中。",,,,,,,,
基础,43,精神,漫游的图克,流浪的图克,51223bd0-ffd1-11df-a976-0801200c9043,盟友,,2,,1,1,1,2,,哈比人.,,,,,,,,,哈比人,行动：下降3点你的威胁等级，以使流浪的图克交由另一位玩家控制。该玩家的威胁等级上升3点（每个回合限制1次）。,,多人,,,,,,
基础,44,精神,罗瑞恩向导,罗瑞安引路人,51223bd0-ffd1-11df-a976-0801200c9044,盟友,,3,,1,1,0,2,,西尔凡精灵.斥候.,,,,,,,,,西尔凡精灵,响应：在指派罗瑞安引路人执行任务后，放置1枚进度标记到激活的地区上。,任务,,,,,,,
基础,45,精神,北方的追踪者,北方的追踪者,51223bd0-ffd1-11df-a976-0801200c9045,盟友,,4,,1,2,2,3,,登丹人. 游侠.,,,,,,,,,登丹人,响应：在指派北方的追踪者执行任务后，在场景区的每个地区上放置1枚进度标记。,任务,,,,,,,
基础,46,精神,加拉兹民的问候,凯兰崔姆的祝福,51223bd0-ffd1-11df-a976-0801200c9046,事件,,3,,,,,,,,,,,,,,,,,行动：一位玩家的威胁等级下降6点，或每位玩家的威胁等级下降2点。,,,,,,,,
基础,47,精神,意志之力,坚强的意志,51223bd0-ffd1-11df-a976-0801200c9047,事件,,0,,,,,,,,,,,,,,,,,响应：在你探索到一个地区后，横置一名【精神】角色，以放置2枚进度标记到该地区上。,任务,,,,,,,
基础,48,精神,仓促的攻击,轻率出击,51223bd0-ffd1-11df-a976-0801200c9048,事件,,1,,,,,,,,,,,,,,,,,响应：取消一个在战斗中刚触发的暗影效果。,防御,,,,,,,
基础,49,精神,西方的意志,西方的意志,51223bd0-ffd1-11df-a976-0801200c9049,事件,,1,,,,,,,,,,,,,,,,,行动：选择一位玩家。将该玩家的弃牌堆洗回他的牌组。将西方的意志移出游戏。,,,,,,,,
基础,50,精神,意志的考验,意志的考验,51223bd0-ffd1-11df-a976-0801200c9050,事件,,1,,,,,,,,,,,,,,,,,响应：取消一个刚从遭遇牌组展示的卡牌的“展示后”效果。,防御,,,,,,,
基础,51,精神,奋起战斗,奋起战斗,51223bd0-ffd1-11df-a976-0801200c9051,事件,,X,,,,,,,,,,,,,,,,,行动：在任一玩家的弃牌堆中选择一名印刷费用为X的盟友。将该盟友放置进场并由你控制。（所选盟友可隶属任意影响力派系。）,,,,,,,,
基础,52,精神,黑暗中的光芒,黑暗中的光明,51223bd0-ffd1-11df-a976-0801200c9052,事件,,2,,,,,,,,,,,,,,,,,行动：选择一个与玩家交锋的敌军。将该敌军返回场景区。,防御,,,,,,,
基础,53,精神,矮人坟墓,矮人墓穴,51223bd0-ffd1-11df-a976-0801200c9053,事件,,1,,,,,,,,,,,,,,,,,行动：从你的弃牌堆返还一张【精神】卡牌到你的手牌。,,,,,,,,
基础,54,精神,运气或命运,运气或命运,51223bd0-ffd1-11df-a976-0801200c9054,事件,,5,,,,,,,,,,,,,,,,,行动：在任一玩家的弃牌堆中选择一名英雄。将该卡牌放置进场，由其拥有者控制。,,,,,,,,
基础,55,精神,夫人的眷顾,女皇的信任,51223bd0-ffd1-11df-a976-0801200c9055,附属,,2,,,,,,,,,,,,,,,,,"附属到一张英雄牌上。 
所附属英雄获得+1【意志力】。",任务,,,,,,,
基础,56,精神,大地的力量,大地的力量,51223bd0-ffd1-11df-a976-0801200c9056,附属,,1,,,,,,,,,,,,,,,,,"附属到一个地区上。 
所附属地区获得-1【威胁值】。",,,,,,,,
基础,57,精神,突来勇气,突来勇气,51223bd0-ffd1-11df-a976-0801200c9057,附属,,2,,,,,,,,,,,,,,,,,"附属到一名英雄上。 
行动：横置突来勇气，以重置所附属英雄。",,单人,,,,,,
基础,58,学识,宁洛德尔之女,宁若戴尔河之女,51223bd0-ffd1-11df-a976-0801200c9058,盟友,,3,,1,0,0,1,,西尔凡精灵.,,,,,,,,,西尔凡精灵,行动：横置宁若戴尔河之女，以治疗任一英雄的最多2点伤害。,,,,,,,,
基础,59,学识,埃瑞博铁匠,依鲁伯铁匠,51223bd0-ffd1-11df-a976-0801200c9059,盟友,,2,,1,1,1,3,,矮人.工匠.,,,,,,,,,矮人,响应：在你打出依鲁伯铁匠后，从任一玩家的弃牌堆中返回一张最顶部的附属牌到他的手牌。,,,,,,,,
基础,60,学识,赫纳玛斯·河曲,赫纳玛斯·河曲,51223bd0-ffd1-11df-a976-0801200c9060,盟友,*,1,,1,1,0,1,,西尔凡精灵.,,,,,,,,,西尔凡精灵,行动：横置赫纳玛斯·河曲，以查看遭遇牌组顶端的一张卡牌。,,单人,,,,,,
基础,61,学识,铁丘陵矿工,铁丘陵的矿工,51223bd0-ffd1-11df-a976-0801200c9061,盟友,,2,,0,1,2,2,,矮人.,,,,,,,,,矮人,响应：在铁丘陵的矿工进场后，从场中选择并弃除一张状态附属牌,,,,,,,,
基础,62,学识,格利奥威奈,葛理欧温,51223bd0-ffd1-11df-a976-0801200c9062,盟友,*,2,,1,0,0,2,,吟游诗人.洛汗.,,,,,,,,,洛汗,行动：横置葛理欧温，以选择一名玩家。该玩家补一张卡牌。,,,,,,,,
基础,63,学识,伊姆拉缀斯的学识,伊姆拉崔的学识,51223bd0-ffd1-11df-a976-0801200c9063,事件,,2,,,,,,,,,,,,,,,,,行动：选择一名角色。治疗该角色的所有伤害。,,,,,,,,
基础,64,学识,罗瑞恩的财富,罗瑞安的财富,51223bd0-ffd1-11df-a976-0801200c9064,事件,,3,,,,,,,,,,,,,,,,,行动：选择一名玩家。该玩家补三张卡牌。,,,,,,,,
基础,65,学识,拉达加斯特的机敏,瑞达加斯特的狡诈,51223bd0-ffd1-11df-a976-0801200c9065,事件,,1,,,,,,,,,,,,,,,,,任务行动：选择一个在场景区的敌军。该敌军不计算它的【威胁值】直到本阶段结束。,,,,,,,,
基础,66,学识,秘径,幽径,51223bd0-ffd1-11df-a976-0801200c9066,事件,,1,,,,,,,,,,,,,,,,,任务行动：选择一个在场景区的地区。该地区不计算它的【威胁值】直到本阶段结束。,,,,,,,,
基础,67,学识,甘道夫的查阅,甘道夫的搜寻,51223bd0-ffd1-11df-a976-0801200c9067,事件,,X,,,,,,,,,,,,,,,,,行动：查看任一玩家牌组顶端的X张卡牌，将其中一张加入其拥有者的手牌，并将余下的卡牌按任意顺序放回牌组顶端。,,,,,,,,
基础,68,学识,贝奥恩的款待,比翁的款待,51223bd0-ffd1-11df-a976-0801200c9068,事件,,5,,,,,,,,,,,,,,,,,行动：选择一位玩家。治疗该玩家控制的每名英雄的所有伤害。,,,,,,,,
基础,69,学识,森林罗网,森林诱捕网,51223bd0-ffd1-11df-a976-0801200c9069,附属,,3,,,,,,,物品.陷阱.,,,,,,,,,,"附属到一个与玩家交锋的敌军上。 
所附属敌军不能攻击。",防御,,,,,,,
基础,70,学识,罗瑞恩的保护者,罗瑞安守护者,51223bd0-ffd1-11df-a976-0801200c9070,附属,,1,,,,,,,头衔.,,,,,,,,,,"附属到一名英雄上。 
行动：从你的手牌中弃除一张卡牌，以使所附属英雄获得+1【防御力】或+1【意志力】直到本阶段结束。每个阶段限制3次。",,,,,,,,
基础,71,学识,黑暗知识,暗黑学识,51223bd0-ffd1-11df-a976-0801200c9071,附属,,1,,,,,,,状态.,,,,,,,,,,"附属到一名英雄上。 
所附属英雄获得-1【意志力】。 
响应：横置暗黑学识，以查看一张刚分配到攻击你的敌军上的暗影牌。",防御,,,,,,,
基础,72,学识,自我保护,自我保护,51223bd0-ffd1-11df-a976-0801200c9072,附属,,3,,,,,,,技能.,,,,,,,,,,"附属到一名角色上。 
行动：横置自我保护，以治疗所附属角色的2点伤害。",,,,,,,,
基础,73,中立,甘道夫,甘道夫,51223bd0-ffd1-11df-a976-0801200c9073,盟友,*,5,,4,4,4,4,,巫师.,,,,,,,,,巫师,"在本回合结束时，从场中弃除甘道夫。 
响应：在甘道夫进场后，（选择其一）：补三张卡牌，或对一个在场的敌军造成4点伤害，或你的威胁等级下降5点。",,,,,,,,
追捕咕噜,1,学识,比尔博·巴金斯,比尔博·巴金斯,51223bd0-ffd1-11df-a976-0801201c9001.jpg,英雄,*,,9,1,1,2,2,,哈比人.,,,,,,,,,哈比人,起始玩家在资源阶段多补一张卡牌。,,,,,,,,
追捕咕噜,2,领导,杜内丹人的标记,登丹人的标记,51223bd0-ffd1-11df-a976-0801201c9002.jpg,附属,,1,,,,,,,记号.,,,,,,,,,,"附属到一名英雄上。 
所附属英雄获得+1【攻击力】。 
行动：从所附属英雄的资源池中支付1枚资源标记，以使登丹人的标记附属到另一名英雄上。",攻击,,,,,,,
追捕咕噜,3,领导,篝火故事,篝火旁的传说,51223bd0-ffd1-11df-a976-0801201c9003.jpg,事件,,1,,,,,,,,,,,,,,,,,行动：每位玩家补一张卡牌。,,多人,,,,,,
追捕咕噜,4,战术,守护之翼,守护之翼,51223bd0-ffd1-11df-a976-0801201c9010.jpg,盟友,,2,,0,0,4,1,,"生物.
巨鹰.",√,,,,,,,,巨鹰,"警戒.
守护之翼不受“限制”附属。 
强制：在守护之翼参与防御的攻击结算后，支付1枚战术资源标记或从场中弃除守护之翼。",防御,多人,,,,,,
追捕咕噜,5,战术,大鹰来了,巨鹰来了,51223bd0-ffd1-11df-a976-0801201c9008.jpg,事件,,0,,,,,,,巨鹰.,,,,,,,,,巨鹰,行动：从你牌组顶端的五张卡牌中搜寻任意数量的巨鹰卡牌并加入你的手牌。将余下的卡牌洗回你的牌组。,,,,,,,,
追捕咕噜,6,精神,西伏尔德驯马师,西谷驯马师,51223bd0-ffd1-11df-a976-0801201c9009.jpg,盟友,,2,,1,0,1,1,,洛汗.,,,,,,,,,洛汗,行动：弃除西谷驯马师，以选择并重置一名英雄。,,,,,,,,
追捕咕噜,7,精神,洛汗集结,洛汗集结,51223bd0-ffd1-11df-a976-0801201c9004.jpg,事件,,1,,,,,,,,,,,,,,,,,行动：从你牌组顶端的十张卡牌中搜寻任意一张洛汗盟友牌并加入你的手牌，然后，将余下的卡牌洗回你的牌组。,,,,,,,,
追捕咕噜,8,学识,幽谷吟游诗人,瑞文戴尔乐手,51223bd0-ffd1-11df-a976-0801201c9005.jpg,盟友,,3,,2,0,0,1,,诺多精灵.,,,,,,,,,诺多精灵,响应：在从你的手牌中打出瑞文戴尔乐手后，从你的牌组中搜寻一张歌谣卡牌并加入你的手牌。将你的牌组洗牌。,,,,,,,,
追捕咕噜,9,学识,大步佬之路,神行客之路,51223bd0-ffd1-11df-a976-0801201c9007.jpg,事件,,1,,,,,,,,,,,,,,,,,响应：在一个地区从遭遇牌组中被展示后，立即探索到该地区，无需结算探索效果。如果当前有激活地区，将其返回场景区。,,,,,,,,
追捕咕噜,10,中立,国王之歌,国王之歌,51223bd0-ffd1-11df-a976-0801201c9006.jpg,附属,,1,a,,,,,,歌谣.,,,,,,,,,,"附属到一名英雄上。 
所附属英雄获得【领导】资源符号。",,,,,,,,
激战卡洛克,25,精神,弗罗多·巴金斯,佛罗多·巴金斯,51223bd0-ffd1-11df-a976-0801202c9001.jpg,英雄,*,,7,2,1,2,2,,哈比人.,,,,,,,,,哈比人,响应：在佛罗多·巴金斯受到伤害后，取消该伤害并以你的威胁等级上升与他本该被分配伤害标记数量相等的点数代替。（每个阶段限制1次）,防御,,,,,,,
激战卡洛克,26,领导,杜内丹人的警告,登丹人的警示,51223bd0-ffd1-11df-a976-0801202c9008.jpg,附属,,1,,,,,,,记号.,,,,,,,,,,"附属到一名英雄上。 
所附属英雄获得+1【防御力】。 
行动：从所附属英雄的资源池中支付1枚资源标记，以使登丹人的警示附属到另一名英雄上。",防御,,,,,,,
激战卡洛克,27,领导,第二顿早餐,第二顿早餐,51223bd0-ffd1-11df-a976-0801202c9024.jpg,事件,,1,,,,,,,,,,,,,,,,,行动：每位玩家从他的弃牌堆中返回一张最顶部的附属牌到他的手牌。,,,,,,,,
激战卡洛克,28,战术,贝奥恩养蜂人,比翁养蜂人,51223bd0-ffd1-11df-a976-0801202c9006.jpg,盟友,,4,,1,2,1,3,,比翁一族.,,,,,,,,,比翁一族,行动：从场中弃除比翁养蜂人，以对场景区中的每个敌军造成1点伤害,攻击,多人,,,,,,
激战卡洛克,29,战术,空中重生,空中重生,51223bd0-ffd1-11df-a976-0801202c9007.jpg,附属,,0,,,,,,,状态.,,,,,,,,,,"附属到一名盟友上。 
行动：从场中弃除空中重生，以使所附属盟友返回其拥有者的手牌。",,,,,,,,
激战卡洛克,30,精神,伊奥蒙德,伊欧蒙德,51223bd0-ffd1-11df-a976-0801202c9009.jpg,盟友,*,3,,2,1,1,2,,洛汗.,,,,,,,,,洛汗,响应：在伊欧蒙德离场后，重置在场的所有洛汗角色。,,多人,,,,,,
激战卡洛克,31,精神,我并不是陌生人,我并非陌生人,51223bd0-ffd1-11df-a976-0801202c9018.jpg,附属,,1,,,,,,,头衔.,,,,,,,,,,"附属到一名角色上。 
所附属角色获得洛汗属性。",,,,,,,,
激战卡洛克,32,学识,长须制图者,长须制图者,51223bd0-ffd1-11df-a976-0801202c9014.jpg,盟友,,3,,1,1,1,3,,矮人.,,,,,,,,,矮人,行动：支付1枚【学识】资源标记，以使长须制图者获得+1【意志力】直到本阶段结束。,,,,,,,,
激战卡洛克,33,学识,燃烧的火把,燃烧的木棍,51223bd0-ffd1-11df-a976-0801202c9010.jpg,附属,,2,,,,,,,物品.,,,√,,,,,,,"附属到一名【学识】角色上。限制.
当所附属角色防御时，横置燃烧的木棍以取消一个在战斗中刚触发的暗影效果。",防御,,,,,,,
激战卡洛克,34,中立,智慧之歌,智慧之歌,51223bd0-ffd1-11df-a976-0801202c9025.jpg,附属,,1,,,,,,,歌谣.,,,,,,,,,,"附属到一名英雄上 
所附属英雄获得【学识】资源符号。",,,,,,,,
罗斯加堡之旅,50,领导,伊姆拉希尔亲王,印拉希尔王子,51223bd0-ffd1-11df-a976-0801203c9001.jpg,英雄,*,,11,2,3,2,4,,刚铎.贵族.,,,,,,,,,刚铎,响应：在一名角色离场后，重置印拉希尔王子。（每回合限制1次）,攻击,多人,,,,,,
罗斯加堡之旅,51,领导,杜内丹人的探险,登丹人的任务,51223bd0-ffd1-11df-a976-0801203c9008.jpg,附属,,2,,,,,,,记号.,,,,,,,,,,"附属到一名英雄上。
所附属英雄获得+1【意志力】。
行动：从所附属英雄的资源池中支付1枚资源标记，以使登丹人的任务附属到另一名英雄上。",任务,,,,,,,
罗斯加堡之旅,52,领导,临别的礼物,临别的礼物,51223bd0-ffd1-11df-a976-0801203c9007.jpg,事件,,0,,,,,,,,,,,,,,,,,行动：将任意数量的资源标记从一名领导英雄的资源池中移至另一名英雄的资源池中。 ,,,,,,,,
罗斯加堡之旅,53,战术,蓝德洛瓦,兰楚瓦,51223bd0-ffd1-11df-a976-0801203c9004.jpg,盟友,*,5,,1,3,1,4,,"生物.
巨鹰.",√,,,,,,,,巨鹰,"警戒.
兰楚瓦不受“限制”附属。
响应：在一名英雄被消灭后，将兰楚瓦返回其拥有者的手牌，以使该英雄放回场中，并具有1枚伤害标记。（每局游戏限制1次）",攻击,多人,,,,,,
罗斯加堡之旅,54,战术,飞往鹰巢,飞往鹰巢,51223bd0-ffd1-11df-a976-0801203c9010.jpg,事件,,2,,,,,,,,,,,,,,,,,响应：在一名盟友被消灭后，横置一名巨鹰角色，以使该盟友从弃牌堆移至其拥有者的手牌。,,,,,,,,
罗斯加堡之旅,55,精神,埃多拉斯护卫队,伊多拉斯护卫队,51223bd0-ffd1-11df-a976-0801203c9009.jpg,盟友,,2,,2,0,0,1,,洛汗.,,,,,,,,,洛汗,"在指派伊多拉斯护卫队执行任务时，其获得+2【意志力】。
强制：在伊多拉斯护卫队被指派执行的任务结算后，从场中弃除伊多拉斯护卫队。",任务,,,,,,,
罗斯加堡之旅,56,精神,古老的马松,古老的马松,51223bd0-ffd1-11df-a976-0801203c9005.jpg,附属,,1,,,,,,,马松.,,,,,,,,,,"附属到一个地区上。
响应：在所附属地区被完全探索后，起始玩家补三张卡牌。",,,,,,,,
罗斯加堡之旅,57,学识,罗瑞恩的哈尔迪尔,罗瑞安的哈尔达,51223bd0-ffd1-11df-a976-0801203c9002.jpg,盟友,*,4,,2,2,2,3,,西尔凡精灵.,√,√,,,,,,,西尔凡精灵,远攻.警戒.,防御,多人,,,,,,
