系列,编号,派系,卡牌名称,备用卡牌名称,图片链接,类型,独有,卡牌费用,初始威胁,意志力,攻击力,防御力,生命值,任务点,属性,警戒,远攻,限制,隐匿,厄运,遭遇,守护,协同,种族,规则文字,功能,人数,精神,战术,领导,学识,中立,1352
大地的根基,102,领导,长须长者,长须长者,51223bd0-ffd1-11df-a976-0801212c9021.jpg,盟友,,3,,2,1,1,2,,矮人.,,,,,,,,,矮人,响应：在指派长须长者执行任务后，查看遭遇牌组顶端的一张卡牌。如果该卡牌是一张地区牌，放置1枚进度标记到当前任务上。否则，长须长者获得-1【意志力】直到本阶段结束。,任务,单人,,,,,,
大地的根基,103,领导,必选之路,必选之路,51223bd0-ffd1-11df-a976-0801212c9028.jpg,附属,,4,,,,,,,状态.,,,,,,,,,,"每套牌组限制一张。
附属到一个地区上。
当所附属地区是激活的地区时，英雄攻击，防御或指派执行任务时无须横置。",,,,,,,,
大地的根基,104,战术,食人妖森林斥候,食人妖之地的斥候,51223bd0-ffd1-11df-a976-0801212c9033.jpg,盟友,,2,,0,2,1,2,,诺多精灵.斥候.,,√,,,,,,,诺多精灵,"远攻.
食人妖之地的斥候攻击时无须横置。
强制：在食人妖之地的斥候攻击后，将其从场中弃除或从你的手牌中弃除一张卡牌。",攻击,,,,,,,
大地的根基,105,战术,重击,重击,51223bd0-ffd1-11df-a976-0801212c9018.jpg,事件,,1,,,,,,,,,,,,,,,,,响应：战斗中，在一名矮人对一个敌军造成X点伤害后，对该敌军造成额外的X点伤害。（每个阶段限制1次）,攻击,,,,,,,
大地的根基,106,精神,伊姆拉缀斯占星师,伊姆拉崔占星师,51223bd0-ffd1-11df-a976-0801212c9019.jpg,盟友,,2,,0,0,1,1,,诺多精灵.,,,,,,,,,诺多精灵,行动：横置伊姆拉崔观星者，以选择一位玩家。该玩家查看他牌组顶端的五张卡牌，然后将它们按任意顺序返回他的牌组顶端。,,,,,,,,
大地的根基,107,精神,维林诺之光,瓦林诺之光,51223bd0-ffd1-11df-a976-0801212c9020.jpg,附属,*,1,,,,,,,状态.,,,,,,,,,,"附属到一名诺多精灵或西尔凡精灵英雄上。
指派所附属英雄执行任务时无须横置。",任务,,,,,,,
大地的根基,108,学识,戴隆的如尼文,戴隆的符文,51223bd0-ffd1-11df-a976-0801212c9010.jpg,事件,,0,,,,,,,,,,,,,,,,,行动：补两张卡牌。然后，从你的手牌中弃除一张卡牌。,,,,,,,,
大地的根基,109,学识,治疗草药,治愈药草,51223bd0-ffd1-11df-a976-0801212c9017.jpg,附属,,0,,,,,,,,,,,,,,,,,"附属到一名【学识】英雄上。
行动：弃除治愈药草并横置所附属英雄，以治疗一名角色的所有伤害。",,,,,,,,
大地的根基,110,学识,阿斯法洛斯,阿斯法洛斯,51223bd0-ffd1-11df-a976-0801212c9001.jpg,附属,*,2,,,,,,,坐骑.,,,,,,,,,,"附属到一名诺多精灵或西尔凡精灵英雄上。
行动：横置阿斯法洛斯，以放置1枚进度标记到任一地区上。（如果所附属英雄是葛罗芬戴尔，以2枚代替。）",,,,,,,,
暗影与烈焰,128,学识,埃尔隆德,爱隆,51223bd0-ffd1-11df-a976-0801213c9004.jpg,英雄,*,,13,3,2,3,4,,诺多精灵. 贵族.,,,,,,,,,诺多精灵,"你可以从爱隆的资源池中花费资源标记，以支付【领导】，【战术】和【精神】盟友的费用。
响应：在一名角色被其它卡牌效果治疗后，额外治疗该角色上的1点伤害。",防御,,,,,,,
暗影与烈焰,129,领导,我们可没闲着,我们并非无所事事,51223bd0-ffd1-11df-a976-0801213c9028.jpg,事件,,0,,,,,,,,,,,,,,,,,行动：横置X名矮人英雄，以增加X枚资源标记到一名英雄的资源池中并补一张卡牌。,,,,,,,,
暗影与烈焰,130,领导,坚毅的领袖,坚毅的领袖,51223bd0-ffd1-11df-a976-0801213c9008.jpg,附属,*,2,,,,,,,,,,,,,,,,,"附属到一名【领导】英雄上。
每名矮人角色获得+1生命值。",防御,,,,,,,
暗影与烈焰,131,战术,张弓搭箭,张弓搭箭,51223bd0-ffd1-11df-a976-0801213c9007.jpg,事件,,1,,,,,,,,,,,,,,,,,行动：横置一名你控制的具有“远攻”关键词的角色，以立即宣告其为攻击者（并结算此次攻击）攻击一个在场景区的敌军。在本次攻击中其获得+1【攻击力】。,攻击,,,,,,,
暗影与烈焰,132,精神,喔，伊尔碧绿丝！姬尔松耐尔！,喔，伊尔碧绿丝！姬尔松耐尔！,51223bd0-ffd1-11df-a976-0801213c9019.jpg,事件,,4,,,,,,,,,,,√,,,,,,"隐匿 4.
响应：在一个非独有敌军攻击你后，将该敌军放置到遭遇牌组的底端。如果你的威胁等级低于该敌军的交锋值，将你的威胁等级设置到与该敌军的交锋值相等的数值。",防御,,,,,,,
暗影与烈焰,133,精神,米茹沃,米卢活,51223bd0-ffd1-11df-a976-0801213c9016.jpg,附属,,1,,,,,,,物品.,,,,,,,,,,"附属到一名英雄上。
行动：弃除米卢活，以（选择两项）：重置所附属英雄，或增加1枚资源标记到所附属英雄的资源池中，或所附属英雄获得+1【意志力】直到本回合结束，或将米卢活放置到你的牌组顶端。",,,,,,,,
暗影与烈焰,134,学识,铸造大师,铸造大师,51223bd0-ffd1-11df-a976-0801213c9015.jpg,盟友,,2,,0,0,1,1,,诺多精灵.工匠.,,,,,,,,,诺多精灵,行动：横置铸造大师，以从你牌组顶端的五张卡牌中搜寻任意一张附属牌并加入你的手牌。将余下的卡牌洗回你的牌组。,,,,,,,,
暗影与烈焰,135,学识,沉思与冥想,沉思与冥想,51223bd0-ffd1-11df-a976-0801213c9020.jpg,事件,,1,,,,,,,,,,,,,,,,,恢复行动：横置两名英雄，以补五张卡牌。,,多人,,,,,,
暗影与烈焰,136,学识,照探前路,照探前路,51223bd0-ffd1-11df-a976-0801213c9022.jpg,事件,,3,,,,,,,,,,,√,,,,,,"隐匿 3.
行动：查看遭遇牌组顶端的三张卡牌。你可以选择一张卡牌并将其移至遭遇牌组底端。将未被选择的卡牌按任意顺序放回遭遇牌组顶端。",,,,,,,,
暗影与烈焰,137,中立,维雅,维雅,51223bd0-ffd1-11df-a976-0801213c9027.jpg,附属,*,2,,,,,,,戒指.宝物.,,,,,,,,,,"附属到爱隆上。他获得【精神】资源符号。
行动：横置爱隆和维雅，以展示你牌组顶端的一张卡牌。如可能，你能立即打出或将其放置进场无须支付费用。否则，将该展示的卡牌移至你的牌组底端。",,,,,,,,
努曼诺尔的后裔,1,战术,贝瑞刚德,贝瑞贡,4823aae3-46ef-4a75-89f9-cbd3aa1b9005.jpg,英雄,*,,10,0,1,4,4,,刚铎.战士.,√,,,,,,,,刚铎,"警戒.
打出武器和防具附属牌到贝瑞贡上的费用减2。",防御,,,,,,,
努曼诺尔的后裔,2,领导,波洛米尔,波罗莫,4823aae3-46ef-4a75-89f9-cbd3aa1b9008.jpg,英雄,*,,11,1,3,2,5,,刚铎.战士.贵族.,,,,,,,,,刚铎,当波罗莫在他的资源池中至少有1枚资源标记时，刚铎盟友获得+1【攻击力】。,攻击,,,,,,,
努曼诺尔的后裔,3,领导,信使骑手,跑腿的信差,4823aae3-46ef-4a75-89f9-cbd3aa1b9016.jpg,盟友,,1,,0,0,0,2,,刚铎.,,,,,,,,,刚铎,行动：横置跑腿的信差，以将1枚资源标记从你控制的一名英雄的资源池中移至另一名英雄的资源池中。,,多人,,,,,,
努曼诺尔的后裔,4,领导,王城看守者,都城守护者,4823aae3-46ef-4a75-89f9-cbd3aa1b9010.jpg,盟友,,5,,1,0,1,3,,刚铎.,,,,,,,,,刚铎,场中每有一名刚铎盟友，打出都城守护者的费用减1。,防御,,,,,,,
努曼诺尔的后裔,5,领导,同德一心,同德一心,4823aae3-46ef-4a75-89f9-cbd3aa1b9060.jpg,事件,,0,,,,,,,,,,,,,,,,,行动：在场的每张刚铎卡牌获得洛汗属性，并且在场的每张洛汗卡牌获得刚铎属性，直到本阶段结束。,,,,,,,,
努曼诺尔的后裔,6,领导,刚铎的财富,刚铎的财富,4823aae3-46ef-4a75-89f9-cbd3aa1b9087.jpg,事件,,0,,,,,,,,,,,,,,,,,行动：选择一名刚铎英雄。增加1枚资源标记到该英雄的资源池中。,,,,,,,,
努曼诺尔的后裔,7,战术,拉马斯防御者,拉马斯守卫,4823aae3-46ef-4a75-89f9-cbd3aa1b9014.jpg,盟友,,2,,0,1,4,1,,刚铎.战士.,,,,,,,,,刚铎,,防御,,,,,,,
努曼诺尔的后裔,8,战术,高墙掩护,高墙掩护,4823aae3-46ef-4a75-89f9-cbd3aa1b9004.jpg,事件,,1,,,,,,,,,,,,,,,,,行动：重置一名刚铎防御角色，该角色获得+1【防御力】直到本阶段结束。,防御,,,,,,,
努曼诺尔的后裔,9,战术,王城长矛,都城之矛,4823aae3-46ef-4a75-89f9-cbd3aa1b9078.jpg,附属,,2,,,,,,,"物品.
武器.",,,√,,,,,,,"限制.
附属到一名【战术】角色上。
每名角色限制一张。
响应：在所附属角色被宣告为防御者后，对攻击的敌军造成1点伤害。",防御,,,,,,,
努曼诺尔的后裔,10,精神,达姆罗德,丹姆拉,4823aae3-46ef-4a75-89f9-cbd3aa1b9013.jpg,盟友,*,4,,1,2,2,2,,刚铎.游侠.,,,,,,,,,刚铎,行动：从场中弃除丹姆拉，以在场景区每有一个敌军则使你的威胁等级下降1点。,,多人,,,,,,
努曼诺尔的后裔,11,精神,点燃烽火,点燃烽火,4823aae3-46ef-4a75-89f9-cbd3aa1b9050.jpg,事件,,5,,,,,,,,,,,,,,,,,行动：所有角色获得+2【防御力】并且防御时无须横置，直到本回合结束。,防御,,,,,,,
努曼诺尔的后裔,12,精神,警戒的和平,警戒的和平,4823aae3-46ef-4a75-89f9-cbd3aa1b9002.jpg,事件,,1,,,,,,,,,,,,,,,,,响应：在一张没有胜利点数的地区牌作为已探索地区离场后，将其返回到遭遇牌组顶端。,,,,,,,,
努曼诺尔的后裔,13,精神,努门诺尔的血统,努曼诺尔的血统,4823aae3-46ef-4a75-89f9-cbd3aa1b9007.jpg,附属,,0,,,,,,,状态.,,,,,,,,,,"附属到一名刚铎或登丹人英雄上。
行动：从所附属英雄的资源池中支付1枚资源标记，以使所附属英雄在其资源池中每有1枚资源标记则获得+1【防御力】直到本阶段结束。（每个阶段限制1次）",防御,,,,,,,
努曼诺尔的后裔,14,学识,拉梅顿猎人,拉密顿猎人,4823aae3-46ef-4a75-89f9-cbd3aa1b9045.jpg,盟友,,2,,1,1,1,1,,刚铎.边境.,,,,,,,,,边境,响应：在从你的手牌中打出拉密顿猎人后，展示你牌组顶端的一张卡牌。如果是边境卡牌，将其加入你的手牌。否则，将其弃除。,,,,,,,,
努曼诺尔的后裔,15,学识,伊希利恩追踪者,伊西立安追踪者,4823aae3-46ef-4a75-89f9-cbd3aa1b9048.jpg,盟友,,2,,0,1,0,3,,刚铎.游侠.,,,,,,,,,刚铎,行动：横置伊西立安追踪者，以使下一张加入场景区的敌军的【威胁值】下降到0，直到本阶段结束。,,,,,,,,
努曼诺尔的后裔,16,学识,学识大师,饱读历史的学者,4823aae3-46ef-4a75-89f9-cbd3aa1b9057.jpg,盟友,,3,,1,0,1,1,,刚铎.,,,,,,,,,刚铎,行动：横置饱读历史的学着，以指定一种卡牌类型。你打出下一张该种类型的【学识】卡牌的费用减1（最少为1），直到本阶段结束。,,,,,,,,
努曼诺尔的后裔,17,学识,尖兵刺桩,游侠刺桩,4823aae3-46ef-4a75-89f9-cbd3aa1b9071.jpg,附属,,2,,,,,,,陷阱.,,,,,,,,,,"将游侠刺桩以未附属状态打出到场景区中。
如果游侠刺桩未附属，将其附属到下一张进入场景区的合理敌军上。
玩家与所附属敌军不进行交锋检定，所附属敌军获得-2【威胁值】。",,,,,,,,
努曼诺尔的后裔,18,中立,佩拉基尔使者,佩拉格使者,4823aae3-46ef-4a75-89f9-cbd3aa1b9015.jpg,盟友,,2,,1,1,0,1,,刚铎.,,,,,,,,,刚铎,响应：在佩拉格使者进场后，增加1枚资源标记到一名刚铎或贵族英雄的资源池中。,,,,,,,,
摄政王的恐惧,1,领导,白肤希尔路因,贺路恩,85699571-9cc3-4ccc-98b0-0e1664893ef5.jpg,英雄,*,,8,1,1,1,4,,边境.,,√,,,,,,,边境,"远攻.
你可以使用贺路恩资源池中的资源，以支付任意派系的边境盟友牌。",,多人,,,,,,
摄政王的恐惧,2,领导,洛斯阿尔那赫战士,罗萨那奇的战士,2e84d805-365c-47ea-9c4f-e3f75daeb9a6.jpg,盟友,,2,,1,1,1,1,,边境.,,,,,,,,,边境,你控制的每名边境角色获得+1【防御力】。,防御,,,,,,,
摄政王的恐惧,3,领导,聚集力量,聚集力量,add42229-f5d1-4c39-a5dd-ec00ad7d0d76.jpg,事件,,0,,,,,,,,,,,,,,,,,行动：从你英雄的资源池弃除2枚资源标记，以增加3枚资源标记到该英雄的资源池中。,,,,,,,,
摄政王的恐惧,4,战术,天鹅骑士,天鹅骑士,c00844d6-1c3c-4e8c-a46c-8de15b8408df.jpg,盟友,,1,,0,0,0,1,,边境.,,,,,,,,,边境,你控制的每名边境角色获得+1【攻击力】。,攻击,,,,,,,
摄政王的恐惧,5,战术,刚铎盾,刚铎之盾,09134509-191b-4903-b4b5-5e650f8143c1.jpg,附属,,1,,,,,,,物品.防具.,,,√,,,,,,,"限制. 
附属到一名英雄上。
每名英雄限制一张。
所附属英雄获得+1【防御力】。（如果所附属英雄具有刚铎属性，则以+2【防御力】代替。）",防御,,,,,,,
摄政王的恐惧,6,精神,埃希尔剑士,伊瑟剑士,1c149f93-9e3b-42fa-878c-80b29563a283.jpg,盟友,,2,,1,1,1,1,,边境.,,,,,,,,,边境,你控制的每名边境角色获得+1【意志力】。,任务,,,,,,,
摄政王的恐惧,7,精神,巴拉西尔之戒,巴拉西尔之戒,0ef9e385-b7e5-4676-a690-2dd8031aa8c8.jpg,附属,*,1,,,,,,,宝物.物品.戒指.,,,,,,,,,,"附属到一名英雄上。
所附属英雄每附属一张宝物附属牌获得+1生命值。
如果所附属英雄是亚拉冈，他还获得一个【学识】资源符号。",防御,,,,,,,
摄政王的恐惧,8,学识,安法拉斯牧民,安法拉斯牧民,4cb4741d-c9d8-4d62-ab4f-50fa80c59fbb.jpg,盟友,,1,,0,0,0,1,,边境.,,,,,,,,,边境,你控制的每名边境角色获得+1生命值。,防御,,,,,,,
摄政王的恐惧,9,学识,米斯兰迪尔的提议,米斯兰达的提议,3c47d373-62bc-4321-9dc1-9b86b2046f68.jpg,事件,,1,,,,,,,,,,,,,,,,,行动：你每控制一名具有印刷【学识】资源符号的英雄，补一张卡牌。,,,,,,,,
摄政王的恐惧,10,中立,丰收,丰收,e02f317e-736c-40a0-8d73-45509fce9ef8.jpg,事件,,0,,,,,,,,,,,,,,,,,行动：指定一个派系。当为指定派系卡牌支付费用时，你能花费任意派系的资源，直到本阶段结束。,,,,,,,,
督伊顿森林,32,学识,米尔泷德,弥尔珑,536c80ba-ad8b-447e-b378-1684508eb0f9.jpg,英雄,*,,8,2,2,1,3,,西尔凡精灵.,,,,,,,,,西尔凡精灵,你控制的每名具有印刷【学识】资源符号的英雄，获得-1初始威胁。,,,,,,,,
督伊顿森林,33,领导,佛朗,佛龙,c6ae1840-dd7d-46ea-baf8-6d30614506de.jpg,盟友,*,3,,1,1,1,3,,边境.,,,,,,,,,边境,当你控制隶属于4种不同影响力派系的边境盟友时，在每个阶段开始时，重置佛龙。,,,,,,,,
督伊顿森林,34,领导,武装的力量,武装的力量,91f28bdf-4b78-4750-9853-65e783e4cb15.jpg,事件,,2,,,,,,,,,,,,,,,,,"如果你控制的每名英雄都具有印刷【领导】资源符号，才能打出。
行动：重置在场的所有盟友。",,,,,,,,
督伊顿森林,35,战术,勇猛无比,勇猛无比,4ed8bd53-0453-4490-a4bb-20a7d793c17f.jpg,附属,,1,,,,,,,技能.,,,,,,,,,,"附属到一名【战术】英雄。每名英雄限制一张。
响应：在所附属英雄攻击并消灭一个敌军后，对另一个与刚被消灭的敌军具有相同属性的敌军造成1点伤害。",攻击,,,,,,,
督伊顿森林,36,战术,战前操练,战前操练,5c7a6b89-0439-4b46-b9f1-09189f981a0d.jpg,事件,,2,,,,,,,,,,,,,,,,,"如果你控制的每名英雄都具有印刷【战术】资源符号，才能打出。
行动：如果当前任务没有“坚守”关键词，其获得“奋战”直到本阶段结束。（角色使用【攻击力】代替【意志力】。）",任务,,,,,,,
督伊顿森林,37,精神,西尔凡流亡者,西尔凡难民,e4fd6e25-982a-464f-82d8-812269864d46.jpg,盟友,,1,,2,0,0,1,,西尔凡精灵.,,,,,,,,,西尔凡精灵,强制：在一名角色离场后，从场中弃除西尔凡难民。,任务,,,,,,,
督伊顿森林,38,精神,对抗魔影,对抗魔影,0801c2c0-2bf7-4a0a-838a-13740f6cdbaf.jpg,事件,,2,,,,,,,,,,,,,,,,,"如果你控制的每名英雄都具有印刷【精神】资源符号，才能打出。
行动：【精神】角色使用他们的【意志力】代替【防御力】直到本阶段结束。",防御,,,,,,,
督伊顿森林,39,学识,港务总管,港务总管,b7f8b82b-c448-4f43-a025-bf6b7e6f0310.jpg,盟友,,3,,1,2,0,2,,诺多精灵.,,,,,,,,,诺多精灵,响应：在一张卡牌效果增加任意数量资源标记到一名你控制的英雄的资源池后，港务总管获得+1【防御力】直到本回合结束。,防御,,,,,,,
督伊顿森林,40,学识,预先警报,预先警报,e678be7e-8048-458d-b4f9-25c2a718fabb.jpg,事件,,2,,,,,,,,,,,,,,,,,"如果你控制的每名英雄都具有印刷【学识】资源符号，才能打出。
行动：敌军不进行交锋检定，直到本阶段结束。",,,,,,,,
督伊顿森林,41,中立,白塔守卫,白塔守卫,31cd848b-a1bc-4ccd-af0c-eb3cc3ba593b.jpg,盟友,,3,,1,0,2,3,,刚铎.,,,,,,,,,刚铎,如果你控制的每名英雄都隶属于同一影响力派系，你可以将无人防御敌军的攻击伤害分配到白塔守卫上，代替分配到一名你控制的英雄上。,防御,,,,,,,
阿蒙丁山的遭遇,56,精神,皮平,皮聘,fd89bdbf-7475-4f3e-96fc-8f5315a90021.jpg,英雄,*,,6,2,1,1,2,,哈比人.,,,,,,,,,哈比人,如果你控制的每名英雄都具有哈比人属性，皮聘获得：“响应：在敌军与你交锋后，上升3点你的威胁等级，以将其返回场景区。该敌军不能与你交锋，直到本回合结束。”,,,,,,,,
阿蒙丁山的遭遇,57,领导,德内梭尔,迪耐瑟,fd89bdbf-7475-4f3e-96fc-8f5315a90022.jpg,盟友,*,4,,3,1,2,3,,刚铎.贵族.,,,,,,,,,刚铎,"你每控制一名已受伤害的英雄，迪耐瑟获得-1【意志力】。
如果迪耐瑟的【意志力】等于或低于0，将其弃除。",任务,,,,,,,
阿蒙丁山的遭遇,58,领导,墨松德领主,摩颂河领主,fd89bdbf-7475-4f3e-96fc-8f5315a90023.jpg,附属,*,1,,,,,,,头衔.,,,,,,,,,,"附属到一名刚铎或边境英雄上。
如果你控制的每名英雄都具有印刷【领导】资源符号，摩颂河领主获得：“响应：在你打出一名【战术】，【精神】或【学识】盟友后，补一张卡牌。”",,,,,,,,
阿蒙丁山的遭遇,59,战术,埃尔达卡之书,艾尔达卡之书,fd89bdbf-7475-4f3e-96fc-8f5315a90024.jpg,附属,*,4,,,,,,,记载.,,,,,,,,,,"附属到一名【战术】英雄上。
你每控制一名具有印刷【战术】资源符号的英雄，打出艾尔达卡之书的费用减1。
行动：弃除艾尔达卡之书，以从你的弃牌堆中打出任意一张【战术】事件牌，如同从你的手牌中打出。然后，将该事件牌放置到你的牌组底端。",,,,,,,,
阿蒙丁山的遭遇,60,战术,刚铎军戒,刚铎军戒,fd89bdbf-7475-4f3e-96fc-8f5315a90025.jpg,事件,,0,,,,,,,刚铎.,,,,,,,,,,响应：取消最多2点刚分配到一名刚铎角色上的伤害。,防御,,,,,,,
阿蒙丁山的遭遇,61,精神,米那斯提力斯制灯匠,米那斯提力斯制灯匠,fd89bdbf-7475-4f3e-96fc-8f5315a90026.jpg,盟友,,1,,0,0,1,1,,刚铎.工匠.,,,,,,,,,刚铎,响应：在一张具有“涌现”关键词的遭遇牌被展示后，弃除米那斯提力斯制灯匠，以指定敌军，地区或阴谋。如果展示的下一张遭遇牌是所指定的类型，将其弃除不结算其效果。,,,,,,,,
阿蒙丁山的遭遇,62,精神,目标过小,弱小的目标,fd89bdbf-7475-4f3e-96fc-8f5315a90027.jpg,事件,,1,,,,,,,,,,,,,,,,,响应：在横置一名你控制的哈比人英雄以防御攻击后，选择与你交锋的另一个敌军，并展示该攻击敌军的暗影牌。如果该暗影牌没有暗影效果，本敌军对被选择的敌军进行攻击。如果该暗影牌具有暗影效果，如常结算本次攻击。,,,,,,,,
阿蒙丁山的遭遇,63,学识,伊希利恩弓手,伊西立安弓箭手,fd89bdbf-7475-4f3e-96fc-8f5315a90028.jpg,盟友,,3,,1,2,1,2,,刚铎.游侠.,,√,,,,,,,刚铎,"远攻.
响应：在伊西立安弓箭手攻击并对敌军造成伤害后，将该敌军返回场景区。",,多人,,,,,,
阿蒙丁山的遭遇,64,学识,伊希利恩坑洞,伊西立安陷阱,fd89bdbf-7475-4f3e-96fc-8f5315a90029.jpg,附属,,1,,,,,,,陷阱.,,,,,,,,,,"将伊西立安陷阱以未附属状态打出到场景区中。
如果伊西立安陷阱未附属，将其附属到下一张进入场景区的合理敌军上。
任意角色可以选择所附属敌军为其攻击的目标。",,多人,,,,,,
阿蒙丁山的遭遇,65,中立,霍比特人的直觉,哈比人的直觉,fd89bdbf-7475-4f3e-96fc-8f5315a90030.jpg,事件,,2,,,,,,,,,,,,,,,,,"如果你的每名英雄都是哈比人，才能打出。
战斗行动：与你交锋的敌军本阶段不能攻击。本阶段你不能宣告攻击。",防御,,,,,,,
强袭奥斯吉力亚斯,81,学识,法拉米尔,法拉墨,323ebfa3-57e5-4394-9f55-284b2f7ee0be.jpg,英雄,*,,11,2,2,2,5,,刚铎.游侠.贵族.,,√,,,,,,,刚铎,"远攻.
场景区中每有一个敌军，法拉墨获得+1【攻击力】。",攻击,多人,,,,,,
强袭奥斯吉力亚斯,82,领导,墨松德之剑,摩颂河之剑,98ba9e54-d6c3-41ff-b886-81a29e29eb64.jpg,附属,*,1,,,,,,,,,,,,,,,,,"附属到一名刚铎盟友。
所附属盟友获得边境属性。",,,,,,,,
强袭奥斯吉力亚斯,83,领导,西方的战士,西方的战士,a2d440c4-6150-4b6f-9a36-faa51ace7908.jpg,事件,,X,,,,,,,边境.,,,,,,,,,,行动：从你的弃牌堆中返回X张边境盟友牌到你的手牌。,,,,,,,,
强袭奥斯吉力亚斯,84,战术,米那斯提力斯骑士,米那斯提力斯的骑士,237b31e7-d0b0-4c1e-bd4a-40a175f7d7d1.jpg,盟友,,3,,0,3,1,3,,刚铎.战士.,,,,,,,,,刚铎,如果你控制的每名英雄都具有印刷【战术】符号，米那斯提力斯的骑士获得：“响应：在米那斯提力斯的骑士进场后，选择场景区中的一个敌军。与该敌军交锋并横置米那斯提力斯的骑士，以宣告其为攻击该敌军的攻击者（并结算此次攻击）。“,攻击,,,,,,,
强袭奥斯吉力亚斯,85,战术,刚铎之火,刚铎之火,a7f12d87-5f28-46ca-a301-0ac48ca5e471.jpg,附属,,0,,,,,,,刚铎.,,,,,,,,,,"附属到一名刚铎或登丹人英雄。
行动：从所附属英雄的资源池中支付1枚资源标记，以使所附属英雄的资源池中每有1枚资源标记，其获得+1【攻击力】直到本阶段结束。（每个阶段限制1次）",攻击,,,,,,,
强袭奥斯吉力亚斯,86,精神,佩拉基尔船木工,佩拉格船木工,d8d1e7b4-3639-4ca0-bc83-daa7f78554b2.jpg,盟友,,3,,0,1,1,3,,刚铎.工匠.,,,,,,,,,刚铎,你每控制一名具有印刷【精神】资源符号的英雄，佩拉格船木工获得+1【意志力】。,任务,,,,,,,
强袭奥斯吉力亚斯,87,精神,埃雅尼尔地图,艾尼尔地图,72cb5c31-c62f-4870-a5f4-099cdec1d4a7.jpg,附属,*,4,,,,,,,记载.,,,,,,,,,,"附属到一名【精神】英雄。
你每控制一名具有印刷【精神】资源符号的英雄，打出艾尼尔地图的费用减1。
行动：弃除艾尼尔地图，以从你的弃牌堆中打出任意一张【精神】事件牌，如同从你的手牌中打出。然后，将该事件牌放置到你的牌组底端。",,,,,,,,
强袭奥斯吉力亚斯,88,学识,尖兵弓,游侠之弓,3fa0b17f-a7d1-4f0c-a779-c20cb6084e78.jpg,附属,,1,,,,,,,"物品.
武器.",,,√,,,,,,,"限制.
附属到一名游侠角色。
行动：横置游侠之弓以及所附属的角色，以对场景区中的一个敌军造成1点伤害。",攻击,,,,,,,
强袭奥斯吉力亚斯,89,学识,森林巡逻,森林巡逻,50aa4aab-6daa-4cb5-bfb1-a13db03c1a23.jpg,事件,,1,,,,,,,,,,,,,,,,,"如果你控制至少一名游侠角色，才能打出。
行动：对一个至少被附属一张陷阱卡牌的敌军造成3点伤害。",,,,,,,,
强袭奥斯吉力亚斯,90,中立,真知晶球,真知晶球,1e9a6c59-8dc7-4dc4-a5a4-f5f4f9ccdc55.jpg,附属,*,1,,,,,,,宝物.物品.,,,,,,,,,,"附属到一名贵族英雄。
计划行动：横置真知晶球以及所附属的英雄，以指定一种卡牌类型并查看遭遇牌组顶端的三张卡牌。这些卡牌中每有一张匹配指定类型的卡牌，补一张卡牌。这些卡牌中每有一张不匹配指定类型的卡牌，你的威胁等级上升2点。",,,,,,,,
刚铎之血,107,精神,卡尔达拉,卡尔达瑞,60725069-031c-4251-9b2c-3f368545e9ac.jpg,英雄,*,,8,2,1,2,3,,刚铎.,,,,,,,,,刚铎,行动：弃除卡尔达瑞，以使你每控制另一名具有印刷【精神】资源符号的英雄，将一张【精神】盟友从你的弃牌堆放置进场（每局游戏限制一次）。,,,,,,,,
刚铎之血,108,领导,王城侍从,都城侍从,d4f034b0-2444-4b61-a249-8d86e8856f7c.jpg,盟友,,1,,0,0,1,1,,刚铎.,,,,,,,,,刚铎,响应：在都城侍从离场后，增加1枚资源标记到一名刚铎英雄的资源池中。,,,,,,,,
刚铎之血,109,领导,阿塔那塔典籍,雅坦纳托典籍,e88d7165-821c-4b04-9869-80ee1f33905c.jpg,附属,*,4,,,,,,,记载.,,,,,,,,,,"附属到一名【领导】英雄。
你每控制一名具有印刷【领导】资源符号的英雄，打雅坦纳托典籍的费用减1。
行动：弃除雅坦纳托典籍，以从你的弃牌堆中打出任意一张【领导】事件牌，如同从你的手牌中打出。然后，将该事件牌放置到你的牌组底端。",,,,,,,,
刚铎之血,110,战术,古斯拉夫,古斯拉夫,06baca74-330a-4038-9387-32ce8657dd8f.jpg,盟友,*,3,,1,1,2,2,,洛汗.,,,,,,,,,洛汗,"如果场中至少有一名洛汗英雄，打出古斯拉夫的费用减1。
如果场中至少有一名刚铎铎雄，古斯拉夫获得“警戒”。",防御,多人,,,,,,
刚铎之血,111,战术,一夫当关,众矢之的,cc2f73af-86c8-4d81-b706-14127adc0b37.jpg,事件,,2,,,,,,,,,,,,,,,,,遭遇行动：与在场的每一个敌军交锋。,,,,,,,,
刚铎之血,112,精神,埃梅瑞,艾莫瑞,314eaf40-1554-4c1a-b643-1f4353e25633.jpg,盟友,*,3,,1,1,2,2,,刚铎.,,,,,,,,,刚铎,行动：弃除你牌组顶端的三张卡牌，以将艾莫瑞从你的手牌中放置进场，交由任一玩家控制。然后，如果弃除的任何卡牌隶属于【领导】，【战术】或【学识】派系，弃除艾莫瑞。,,多人,,,,,,
